{
  "schema_version": "horizon.knowledge-frame.v1",
  "corpus_id": "horizon-cross-domain-seed-v1",
  "purpose": "Cross-domain pilot corpus for structured knowledge representation and runtime integration. Includes Indonesian lexical, aspectual, causal, and discourse frames; mathematics; physical sciences; biology and neuroscience; computing and engineering; and empirical reasoning. Model-synthesized entries are explicitly unverified; formal mathematics entries state assumptions and derivations. This is not a complete or externally reviewed knowledge base.",
  "records": [
    {
      "schema_version": "horizon.knowledge-frame.v1",
      "id": "id-language-id-membuka-physical",
      "domain": "language",
      "subdomain": "Indonesian semantics",
      "kind": "lexical_sense",
      "status": "model_synthesized_unverified",
      "content": {
        "summary": "Sense of 'membuka' meaning to cause a closed physical object or access boundary to become open.",
        "terms": [
          "membuka",
          "buka",
          "terbuka",
          "menutup"
        ],
        "lexical": {
          "surface": "membuka",
          "lemma": "buka",
          "part_of_speech": "verb",
          "morphology": [
            "meN- + buka"
          ],
          "sense_id": "membuka.physical-access",
          "register": [
            "neutral"
          ],
          "argument_roles": [
            {
              "role": "Agent",
              "description": "Entity intentionally or causally initiating the opening",
              "required": true
            },
            {
              "role": "Theme",
              "description": "Door, lid, gate, container, or other thing whose state changes",
              "required": true
            },
            {
              "role": "Instrument",
              "description": "Optional means used to cause the change",
              "required": false
            }
          ],
          "presuppositions": [
            "A relevant boundary or object has an open/closed state distinction."
          ],
          "implicatures": [],
          "examples": [
            {
              "text": "Rina membuka pintu.",
              "interpretation": "Rina causes the door to move from closed or less open to open.",
              "context": "Physical access boundary."
            }
          ]
        },
        "entities": [
          {
            "id": "agent",
            "type": "entity-role",
            "label": "Agent"
          },
          {
            "id": "door",
            "type": "physical-object",
            "label": "door"
          }
        ],
        "relations": [
          {
            "type": "causes-state-transition",
            "from": "agent",
            "to": "door",
            "direction": "agent causes the door's open-state to change",
            "conditions": [
              "An agent or causal force can affect the object."
            ],
            "confidence": 0.7
          }
        ],
        "state_model": {
          "initial_state": [
            "The door is closed or less open than the target state."
          ],
          "trigger_or_conditions": [
            "An agent or force acts on the door; the door is movable and not blocked."
          ],
          "mechanism_or_transition": [
            "The door's position or configuration changes."
          ],
          "resulting_state": [
            "The door is open or more open than before."
          ],
          "temporal_order": [
            "action begins",
            "door state changes",
            "resulting access changes if the doorway is unobstructed"
          ],
          "invariants": [
            "Opening a door does not guarantee that the space beyond it is safe or accessible."
          ],
          "unknowns": [
            "Exact opening angle and physical mechanism depend on the door and context."
          ]
        },
        "context_conditions": [
          "Physical object or access boundary context."
        ],
        "constraints": [
          "Do not infer that the door is fully open unless context says so."
        ],
        "limitations": [
          "The lexical sense alone does not determine agent intention or exact final position."
        ],
        "cross_references": [
          "Indonesian morphology: meN- verbs",
          "Indonesian syntax: transitive clauses",
          "Knowledge frame: state transitions"
        ]
      },
      "epistemic": {
        "basis": "model_synthesis",
        "confidence": 0.7,
        "evidence_summary": "Illustrative lexical-semantic analysis based on general Indonesian usage; requires linguistic review.",
        "source_ids": [],
        "source_urls": [],
        "revision_conditions": [
          "Review against an authoritative Indonesian dictionary and corpus examples."
        ]
      }
    },
    {
      "schema_version": "horizon.knowledge-frame.v1",
      "id": "id-language-id-membuka-metaphorical",
      "domain": "language",
      "subdomain": "Indonesian semantics and pragmatics",
      "kind": "lexical_sense",
      "status": "model_synthesized_unverified",
      "content": {
        "summary": "Metaphorical or institutional uses of 'membuka' where an event, resource, information, or opportunity becomes available or begins.",
        "terms": [
          "membuka rapat",
          "membuka rekening",
          "membuka rahasia",
          "membuka peluang"
        ],
        "lexical": {
          "surface": "membuka",
          "lemma": "buka",
          "part_of_speech": "verb",
          "sense_id": "membuka.metaphorical-or-institutional",
          "argument_roles": [
            {
              "role": "Agent",
              "description": "Person or institution initiating the event or change",
              "required": true
            },
            {
              "role": "Theme",
              "description": "Meeting, account, secret, opportunity, or other context-specific target",
              "required": true
            }
          ],
          "examples": [
            {
              "text": "Ketua membuka rapat.",
              "interpretation": "The chair initiates the meeting, not a physical opening.",
              "context": "Institutional event."
            },
            {
              "text": "Ia membuka rekening.",
              "interpretation": "A financial account is established or activated under a financial institution's process.",
              "context": "Financial service."
            },
            {
              "text": "Ia membuka rahasia.",
              "interpretation": "Previously concealed information is disclosed.",
              "context": "Information access."
            },
            {
              "text": "Keputusan itu membuka peluang.",
              "interpretation": "The decision creates or makes an opportunity available.",
              "context": "Abstract possibility."
            }
          ]
        },
        "relations": [
          {
            "type": "polysemy-family",
            "from": "membuka.physical-access",
            "to": "membuka.metaphorical-or-institutional",
            "direction": "related form with context-dependent senses",
            "confidence": 0.65
          }
        ],
        "state_model": {
          "initial_state": [
            "The meeting has not started, the account is not established, information is concealed, or the opportunity is not available; the exact state depends on the theme."
          ],
          "trigger_or_conditions": [
            "A contextually appropriate initiating, establishing, disclosing, or enabling action occurs."
          ],
          "mechanism_or_transition": [
            "The target's institutional, informational, or possibility status changes."
          ],
          "resulting_state": [
            "The meeting begins, account becomes established, information becomes known, or opportunity becomes available, depending on context."
          ],
          "unknowns": [
            "The target sense cannot be determined from the verb alone when its complement and context are absent."
          ]
        },
        "context_conditions": [
          "Interpretation depends on the noun phrase, predicate arguments, discourse, and domain."
        ],
        "constraints": [
          "Do not collapse these uses into the physical door-opening sense."
        ],
        "limitations": [
          "The four examples illustrate distinct senses or conventional constructions; fine-grained dictionary sense boundaries require lexical review."
        ],
        "cross_references": [
          "Indonesian pragmatics",
          "Indonesian syntax",
          "Knowledge frame: ambiguity"
        ]
      },
      "epistemic": {
        "basis": "model_synthesis",
        "confidence": 0.65,
        "evidence_summary": "Illustrative analysis of common Indonesian constructions; sense inventory requires lexicographic review.",
        "revision_conditions": [
          "Review dictionary sense divisions and corpus usage."
        ]
      }
    },
    {
      "schema_version": "horizon.knowledge-frame.v1",
      "id": "id-math-linear-equation-example",
      "domain": "mathematics",
      "subdomain": "algebra",
      "kind": "mathematical_relation",
      "status": "established",
      "content": {
        "summary": "Solving a linear equation by applying equivalent operations to both sides.",
        "terms": [
          "equation",
          "variable",
          "equality",
          "inverse operation"
        ],
        "definition": "For 2x + 3 = 7 over the real numbers, subtracting 3 from both sides gives 2x = 4; dividing both sides by 2 gives x = 2.",
        "equation": "2x + 3 = 7 ⇒ 2x = 4 ⇒ x = 2",
        "state_model": {
          "initial_state": [
            "Equation 2x + 3 = 7; unknown x belongs to the real numbers."
          ],